{
  "_meta": {
    "generated_at": "2026-04-30T14:00:00Z",
    "valid_until": "2026-05-01T14:00:00Z",
    "pack_name": "Internal Ops Briefing",
    "schema_version": "1.0.0"
  },
  "leadership": {
    "ceo": { "name": "Maya Patel", "since": "2024-01-15" },
    "cfo": { "name": "Jordan Lee", "since": "2025-09-01" },
    "cto": { "name": "Alex Park", "since": "2026-02-15", "previous": "Sarah Chen" },
    "vp_engineering": { "name": "Riley Tan", "since": "2025-06-01" },
    "vp_sales": { "name": "Casey Singh", "since": "2025-11-01" }
  },
  "people_on_vacation": [
    { "name": "Riley Tan", "role": "VP Engineering", "return_date": "2026-05-06", "reason": "conference" },
    { "name": "Sam Rivera", "role": "Senior PM", "return_date": "2026-05-10" }
  ],
  "recent_hires_departures": {
    "hires": [
      { "name": "Quinn Park", "role": "Senior Backend Eng", "started": "2026-04-15" }
    ],
    "departures": [
      { "name": "Sarah Chen", "role": "CTO", "left": "2026-02-10" }
    ]
  },
  "current_priorities": [
    { "title": "Launch Atlas v4 to production", "owner": "Alex Park", "status": "on_track" },
    { "title": "Q2 enterprise pipeline build", "owner": "Casey Singh", "status": "at_risk" },
    { "title": "Hire VP Marketing", "owner": "Maya Patel", "status": "on_track" }
  ],
  "active_incidents": [],
  "internal_tool_versions": {
    "atlas_payments_sdk": "4.1.2",
    "mobilekit": "4.2.0",
    "auth_proxy": "2.7.0",
    "deploy_cli": "1.8.3"
  },
  "corrections": [
    { "wrong": "Sarah Chen is the CTO", "right": "Sarah Chen departed 2026-02-10. The current CTO is Alex Park.", "context": "leadership transition" },
    { "wrong": "mobilekit v3 is current", "right": "mobilekit v4.2 is current; v3 deprecated 2025-12.", "context": "SDK upgrade" }
  ],
  "upcoming_events": [
    { "title": "All-hands", "date": "2026-05-08" },
    { "title": "Atlas v4 launch", "date": "2026-05-21" }
  ]
}
